{
  "meta": {
    "eyebrow": "Family Road Trip",
    "heading": "平溪 <span class='amp'>×</span> 深坑<br>親子自駕小旅行",
    "sub": "沿著 106 縣道，天燈線一路慢玩到深坑老街",
    "chips": ["🗓 <b>7/24–7/26</b> 週五→週日", "👨‍👩‍👧‍👦 <b>2 大 2 小</b>", "🚗 自駕"],
    "trip": { "start": "2026-07-24", "end": "2026-07-26" }
  },

  "dayColors": { "1": "#d5601f", "2": "#4f7a55", "3": "#3f6f97" },
  "dayEmoji": { "1": "🏮", "2": "🐼", "3": "🚠" },

  "map": {
    "hint": "點地圖上的標記看說明與「導航」按鈕。標記位置為概略示意，導航會用店名精準定位。",
    "legend": [
      "<i class='dot' style='background:#d5601f'></i>Day 1 平溪",
      "<i class='dot' style='background:#4f7a55'></i>Day 2 深坑",
      "<i class='dot' style='background:#3f6f97'></i>Day 3 回家",
      "🏨 住宿"
    ],
    "places": [
      {
        "name": "溪隱之宿民宿",
        "desc": "7/24 住宿 · 平溪老街旁",
        "query": "溪隱之宿民宿 平溪",
        "lat": 25.0256,
        "lng": 121.7385,
        "day": 1,
        "hotel": true
      },
      {
        "name": "十分瀑布",
        "desc": "台版尼加拉瀑布，親子必看",
        "query": "十分瀑布",
        "lat": 25.0448,
        "lng": 121.7852,
        "day": 1
      },
      {
        "name": "十分老街",
        "desc": "鐵軌上放天燈",
        "query": "十分老街",
        "lat": 25.0409,
        "lng": 121.7753,
        "day": 1
      },
      {
        "name": "菁桐老街",
        "desc": "日式老車站（選配）",
        "query": "菁桐老街",
        "lat": 25.0232,
        "lng": 121.724,
        "day": 1
      },
      {
        "name": "平溪老街",
        "desc": "週五夜放天燈（人少）",
        "query": "平溪老街",
        "lat": 25.0257,
        "lng": 121.7386,
        "day": 1
      },
      {
        "name": "臺北市立動物園",
        "desc": "7/25 · 貓熊企鵝，未滿6歲免費",
        "query": "臺北市立動物園",
        "lat": 24.9984,
        "lng": 121.5813,
        "day": 2
      },
      {
        "name": "深坑老街",
        "desc": "7/25 午餐 · 臭豆腐重頭戲",
        "query": "深坑老街",
        "lat": 24.9985,
        "lng": 121.6156,
        "day": 2
      },
      {
        "name": "福容大飯店 台北二館",
        "desc": "7/25 住宿 · 室內泳池",
        "query": "福容大飯店台北二館 深坑",
        "lat": 25.0002,
        "lng": 121.618,
        "day": 2,
        "hotel": true
      },
      {
        "name": "貓空纜車（動物園站）",
        "desc": "7/26 方案A · 纜車喝茶",
        "query": "貓空纜車 動物園站",
        "lat": 24.998,
        "lng": 121.5796,
        "day": 3
      },
      {
        "name": "石碇千島湖",
        "desc": "7/26 方案B · 湖景絕美",
        "query": "石碇千島湖 八卦茶園",
        "lat": 24.91,
        "lng": 121.645,
        "day": 3
      }
    ]
  },

  "stays": [
    {
      "night": "7/24 週五 · 第一晚",
      "name": "溪隱之宿民宿",
      "addr": "新北市平溪區公園街 15 號 · 平溪老街旁，步行至平溪車站約 5 分",
      "feat": "平溪天燈線核心位置，放天燈走幾步就到",
      "query": "溪隱之宿民宿 平溪",
      "tel": "0932-326-256"
    },
    {
      "night": "7/25 週六 · 第二晚",
      "name": "福容大飯店 台北二館",
      "addr": "新北市深坑區北深路三段 236 號",
      "feat": "🏊 室內游泳池 · 🅿 免費停車 · 深坑老街步行可到",
      "query": "福容大飯店台北二館 深坑",
      "tel": "02-2662-0088"
    }
  ],

  "days": [
    {
      "id": "day1",
      "tag": "Day 1",
      "color": "",
      "date": "7/24 週五 · 中午抵達",
      "title": "平溪天燈線，玩整個下午 🏮",
      "stops": [
        {
          "time": "11:35",
          "title": "抵達平溪 · 老街午餐",
          "bullets": ["老街小吃、雞捲、芋圓，先填飽肚子"]
        },
        {
          "time": "13:30",
          "title": "十分瀑布 & 十分老街",
          "drive": "🚗 平溪往東約 10–12 分",
          "query": "十分瀑布",
          "bullets": [
            "<b>十分瀑布</b>：台版尼加拉瀑布，步道平緩可推車（免費）",
            "<b>十分老街</b>：鐵軌上放天燈，火車經過超有戲 🚂"
          ]
        },
        {
          "time": "16:00",
          "color": "g",
          "title": "菁桐老街 & 車站",
          "badge": "選配",
          "drive": "🚗 十分→菁桐約 20 分",
          "query": "菁桐老街",
          "bullets": ["日式老車站、許願竹筒，人少好拍照"]
        },
        {
          "time": "17:30",
          "highlight": true,
          "title": "入住溪隱之宿 · 晚餐 · ⭐ 夜放天燈 🏮",
          "query": "平溪老街",
          "bullets": [
            "<b>週五夜人潮最少</b>：平日遊客比週六少，不排隊、拍照乾淨",
            "首選<b>平溪老街</b>（民宿旁最方便）；想在鐵軌上放 → 十分傍晚 4–5 點去"
          ]
        }
      ]
    },
    {
      "id": "day2",
      "tag": "Day 2",
      "color": "g",
      "date": "7/25 週六",
      "title": "平溪 → 動物園 → 深坑 🐼",
      "stops": [
        { "time": "上午", "title": "退房，沿 106 往西下山" },
        {
          "time": "09:30",
          "title": "臺北市立動物園（木柵）",
          "drive": "🚗 平溪→動物園約 40 分",
          "query": "臺北市立動物園",
          "bullets": [
            "貓熊、無尾熊、企鵝館（成人 NT$60，<b>未滿 6 歲免費</b>）",
            "園區大，搭<b>遊園列車</b>省小小孩腳力，鎖定 3–4 館別就好"
          ]
        },
        {
          "time": "午餐",
          "title": "深坑老街 🥘",
          "drive": "🚗 動物園→深坑約 12–15 分",
          "query": "深坑老街",
          "bullets": ["招牌深坑臭豆腐、豆腐冰淇淋、古早味小吃（美食清單見下）"]
        },
        {
          "time": "15:00",
          "title": "入住福容台北二館 · 泳池放電 🏊",
          "bullets": ["深坑老街步行可到，下午讓小孩玩水放電"]
        }
      ]
    },
    {
      "id": "day3",
      "tag": "Day 3",
      "color": "b",
      "date": "7/26 週日 · 回家",
      "title": "深坑周邊玩一站，再上國道回家 🚗",
      "stops": [
        {
          "time": "上午",
          "title": "飯店早餐、泳池，悠閒不趕",
          "bullets": ["~10:30 退房，上午擇一 👇"]
        },
        {
          "time": "方案 A",
          "opt": true,
          "title": "貓空纜車 + 貓空喝茶",
          "query": "貓空纜車 動物園站",
          "bullets": ["深坑旁，週日營運，纜車俯瞰台北盆地，親子友善"]
        },
        {
          "time": "方案 B",
          "opt": true,
          "title": "石碇老街 + 千島湖觀景",
          "query": "石碇千島湖 八卦茶園",
          "bullets": ["106 沿線，吊腳樓、豆腐美食，千島湖湖景絕美"]
        },
        {
          "time": "午後",
          "title": "走國道3號深坑交流道回家",
          "drive": "🚗 深坑→交流道約 5 分，回程各方向都順"
        }
      ]
    }
  ],

  "food": {
    "cards": [
      {
        "title": "深坑老街 · 臭豆腐重頭戲 🥘",
        "green": false,
        "items": [
          "<b>深坑古早厝</b>：麻辣鴨血臭豆腐、清蒸臭豆腐、黃金閹雞 — 首創麻辣、4.1★ 在地霸主",
          "<b>深坑小師父</b>：麻辣鴨血臭豆腐＋私房菜（芋頭米粉、桂竹筍）— 坐下來吃、帶小孩首選",
          "<b>金大鼎串烤臭豆腐</b>：碳烤臭豆腐串 — 拿著吃、氣味不衝、小孩接受度高",
          "王水成深坑老店：紅燒臭豆腐、大腸豆腐（老字號）"
        ],
        "navs": [
          { "label": "古早厝 ↗", "query": "深坑古早厝臭豆腐" },
          { "label": "小師父 ↗", "query": "深坑小師父 臭豆腐" },
          { "label": "金大鼎串烤 ↗", "query": "金大鼎串烤臭豆腐 深坑" }
        ],
        "note": "💡 坐下來吃選<b>小師父</b>，愛麻辣衝<b>古早厝</b>，再外帶<b>金大鼎串烤</b>＋豆腐冰淇淋邊逛邊吃。"
      },
      {
        "title": "十分 · 平溪 · 菁桐",
        "green": true,
        "items": [
          "<b>鐵道熱腸（平溪香腸雞排）</b>：30年炭火香腸、大腸包小腸，游阿嬤手工灌製",
          "<b>楊家雞捲</b>（十分）：現炸酥脆多汁，小孩很愛",
          "十分：古早味花生捲冰淇淋（小孩版免香菜）",
          "平溪：古早味麵茶、花生湯、炭火香腸、酥皮窯烤雞",
          "菁桐：天燈造型鳳梨酥（伴手禮）、礦工便當"
        ],
        "navs": [
          { "label": "鐵道熱腸 ↗", "query": "鐵道熱腸 平溪香腸雞排 十分" },
          { "label": "楊家雞捲 ↗", "query": "楊家雞捲 十分老街" }
        ]
      }
    ],
    "note": "👶 <b>小孩友善</b>（氣味不衝、拿著吃）：金大鼎串烤、雞捲、香腸／大腸包小腸、花生捲冰淇淋、豆腐冰淇淋 🍦"
  },

  "packing": [
    "健保卡（含兒童）、身分證",
    "住宿訂房資料",
    "現金（老街小攤、停車費）",
    "輕便雨衣 ×4、折傘",
    "泳衣泳褲、泳圈／臂圈、泳鏡",
    "玩水後換洗衣物 ×2套/人",
    "防曬乳、遮陽帽",
    "防蚊液",
    "暈車藥／嘔吐塑膠袋（106山路）",
    "兒童水壺、零食",
    "濕紙巾、衛生紙",
    "小孩替換鞋（瀑布濕滑）",
    "常備藥、OK繃、體溫計",
    "行動電源、充電線",
    "相機／手機（拍天燈）",
    "帽子雨具收納袋（防水）"
  ],

  "tipsHeading": "🌧️ 雨天備案 & 自駕重點",
  "rainy": {
    "title": "雨天備案（7月午後常雷陣雨）",
    "items": [
      {
        "ic": "🚂",
        "html": "<b>十分瀑布</b>遇雨 → 改<b>臺灣煤礦博物館</b>（室內＋懷舊小火車，親子友善）"
      },
      { "ic": "🏮", "html": "<b>放天燈</b>：老街多有騎樓棚架，小雨仍可放；大雨才暫停，可隔天補放" },
      { "ic": "🐧", "html": "<b>動物園</b>遇雨 → 主攻室內館：企鵝、無尾熊、兩棲爬蟲、教育中心" },
      { "ic": "🏊", "html": "<b>最強後盾＝福容室內泳池</b>，天氣再爛小孩照樣放電" }
    ]
  },
  "drive": {
    "title": "自駕重點",
    "items": [
      { "ic": "🛣", "html": "主走 <b>106 縣道</b>，山路彎多路窄，放慢、注意會車與火車平交道" },
      { "ic": "🤢", "html": "山路易暈車 → 備<b>暈車藥／塑膠袋</b>，車內通風、開慢" },
      {
        "ic": "🅿",
        "html": "平溪／十分／深坑老街<b>付費停車</b>，假日早到卡位；福容<b>免費停車</b>"
      },
      { "ic": "⛽", "html": "山區加油站少，進平溪前或下山前<b>先加滿油</b>" }
    ],
    "table": [
      ["溪隱之宿 → 十分瀑布", "10–12 分"],
      ["十分 → 菁桐", "約 20 分"],
      ["平溪 → 木柵動物園", "約 40 分"],
      ["動物園 → 深坑（福容）", "12–15 分"],
      ["深坑 → 國道3號交流道", "約 5 分"]
    ]
  },

  "wish": {
    "intro": "寫下願望，按一下放天燈，看它冉冉升空 ✨（願望會存在這支手機裡）",
    "placeholder": "輸入願望…（例：全家平安健康）",
    "whoPlaceholder": "署名（選填）",
    "button": "放天燈 🏮",
    "suggestHint": "💡 想不到寫什麼？點一下帶入願望（可複選、可按 🎲 隨機）：",
    "suggests": [
      "全家平安健康",
      "旅途平安順利",
      "心想事成",
      "學業進步",
      "天天開心",
      "身體健康",
      "財源滾滾",
      "考試一百分",
      "爸媽我愛你",
      "快快長大"
    ],
    "pool": [
      "歲歲平安",
      "闔家歡樂",
      "萬事如意",
      "幸福美滿",
      "夢想成真",
      "天天好心情",
      "出遊順利",
      "天氣晴朗",
      "長高高",
      "交到好朋友",
      "工作順利",
      "中大獎"
    ]
  },

  "footer": ["祝旅途愉快，天燈願望都成真！", "地圖標記與導航皆可點，適合邊開邊看"]
}
